{
  "schema_version": "0.7.0",
  "ontology_version": "pattern-ontology-en-us-internal-0.1.1",
  "bundle_hash": "sha256:0000000000000000000000000000000000000000000000000000000000000000",
  "corpus_release_hash": "sha256:5d5e46af054c722e9ced6c596bc912983fad8eaf6a62b85b8b52103e40088f5c",
  "locale": "en-US",
  "status": "candidate",
  "records": [
    {
      "id": "ont_eaf04a6c7c3640f3338b4cf0a3afed26",
      "meaning_class": "source_supported",
      "locale": "en-US",
      "feature_predicate": {
        "type": "angle",
        "angle": "ascendant"
      },
      "normalized_proposition": "The ascendant is associated with the approach a person leads with, which is not the same as what they are like.",
      "source_fragment_ids": [
        "srcf_1ee96809b893e80aecb41262248350e7"
      ],
      "input_meaning_ids": [],
      "transformation_class": null,
      "tensions": [
        "The tension is that the approach is frequently mistaken for the whole, by other people and sometimes by the person using it."
      ],
      "counter_expressions": [
        "The counter-expression is that a reliable approach is a real asset rather than a mask."
      ],
      "prohibited_claims": [
        "a false self",
        "a personality disorder",
        "how you really are"
      ],
      "salience_band": "medium",
      "presentation_priority": 2,
      "cluster_tags": [
        "5"
      ]
    },
    {
      "id": "ont_4443c03f915a6d40180469fbefe62281",
      "meaning_class": "source_supported",
      "locale": "en-US",
      "feature_predicate": {
        "type": "aspect",
        "aspect": "conjunction"
      },
      "normalized_proposition": "A conjunction is associated with two tendencies that operate as a single instrument and are not experienced separately.",
      "source_fragment_ids": [
        "srcf_73dbb8b5679edd15e4da92f778961c3b"
      ],
      "input_meaning_ids": [],
      "transformation_class": null,
      "tensions": [
        "The tension is that fused material cannot be applied selectively."
      ],
      "counter_expressions": [
        "The counter-expression is concentration.",
        "Two tendencies acting as one produce more force in that direction than the same two acting independently, and the areas where a person is unusually effective are frequently built this way."
      ],
      "prohibited_claims": [
        "an intensified problem",
        "a powerful gift",
        "a guaranteed outcome"
      ],
      "salience_band": "high",
      "presentation_priority": 5,
      "cluster_tags": [
        "4"
      ]
    },
    {
      "id": "ont_1067d1a6c32d9f718e85f4cdddaf43c7",
      "meaning_class": "source_supported",
      "locale": "en-US",
      "feature_predicate": {
        "type": "angle",
        "angle": "descendant"
      },
      "normalized_proposition": "The descendant is associated with the qualities a person reliably meets in others rather than supplies themselves.",
      "source_fragment_ids": [
        "srcf_b91ff478ba547fe0e65a0ec7f8e70fb2"
      ],
      "input_meaning_ids": [],
      "transformation_class": null,
      "tensions": [
        "The tension is that anything met repeatedly gets attributed to the people supplying it."
      ],
      "counter_expressions": [
        "The counter-expression is that reliably meeting a quality is a form of access to it."
      ],
      "prohibited_claims": [
        "you attract people who",
        "the kind of partner you",
        "relationship problems"
      ],
      "salience_band": "medium",
      "presentation_priority": 14,
      "cluster_tags": [
        "5"
      ]
    },
    {
      "id": "ont_3b094673612330403d91d4dee292a365",
      "meaning_class": "source_supported",
      "locale": "en-US",
      "feature_predicate": {
        "type": "house_cusp",
        "house": 8
      },
      "normalized_proposition": "The eighth house is associated with what is held jointly, where nothing can be settled without the other party.",
      "source_fragment_ids": [
        "srcf_912a569ef8cd81807fc6b5af99c6fa2b"
      ],
      "input_meaning_ids": [],
      "transformation_class": null,
      "tensions": [
        "The tension is that merged holdings are entered for good reasons and are difficult to reverse."
      ],
      "counter_expressions": [
        "The counter-expression is that merging is what makes things possible at a scale no one reaches alone."
      ],
      "prohibited_claims": [
        "an inheritance",
        "a death in the family",
        "your sex life"
      ],
      "salience_band": "medium",
      "presentation_priority": 15,
      "cluster_tags": [
        "3"
      ]
    },
    {
      "id": "ont_df2209d2681ccac385428f7fce98eff4",
      "meaning_class": "source_supported",
      "locale": "en-US",
      "feature_predicate": {
        "type": "house_cusp",
        "house": 11
      },
      "normalized_proposition": "The eleventh house is associated with the wider network of loose ties, where belonging is partial and revocable.",
      "source_fragment_ids": [
        "srcf_736d4235bcf5586f7dd4d450319c27a6"
      ],
      "input_meaning_ids": [],
      "transformation_class": null,
      "tensions": [
        "The tension is that loose ties are held loosely by both sides."
      ],
      "counter_expressions": [
        "The counter-expression is that loose ties carry information and opportunity that close ones structurally cannot, because close contacts mostly know what a person already knows."
      ],
      "prohibited_claims": [
        "your true friends",
        "a social circle will",
        "a wish will be granted"
      ],
      "salience_band": "medium",
      "presentation_priority": 16,
      "cluster_tags": [
        "3"
      ]
    },
    {
      "id": "ont_856eb4e0497b61a3e1bff2caa16e4544",
      "meaning_class": "source_supported",
      "locale": "en-US",
      "feature_predicate": {
        "type": "house_cusp",
        "house": 5
      },
      "normalized_proposition": "The fifth house is associated with what is made or done for its own sake, without a justification outside itself.",
      "source_fragment_ids": [
        "srcf_2b92ab1fefd26680ab7e033c0496a9df"
      ],
      "input_meaning_ids": [],
      "transformation_class": null,
      "tensions": [
        "The tension is that adults are poorly equipped to protect activity with no external warrant.",
        "It is the first thing cut when time is short, and it is difficult to defend in a conversation, because any defence offered turns it into something with a purpose and quietly destroys it."
      ],
      "counter_expressions": [
        "The counter-expression is that this is where things get tried before there is a reason to try them."
      ],
      "prohibited_claims": [
        "whether you will have children",
        "a romantic encounter",
        "artistic talent"
      ],
      "salience_band": "medium",
      "presentation_priority": 17,
      "cluster_tags": [
        "3"
      ]
    },
    {
      "id": "ont_b714fbfd19ef959277701395888a6080",
      "meaning_class": "source_supported",
      "locale": "en-US",
      "feature_predicate": {
        "type": "house_cusp",
        "house": 1
      },
      "normalized_proposition": "The first house is associated with the immediate arena a person acts from, before anything has been negotiated.",
      "source_fragment_ids": [
        "srcf_18461175b13ec4da783ee276c89b6f46"
      ],
      "input_meaning_ids": [],
      "transformation_class": null,
      "tensions": [
        "The tension is exactly that."
      ],
      "counter_expressions": [
        "The counter-expression is that these conditions are also the most available."
      ],
      "prohibited_claims": [
        "physical appearance",
        "your body type",
        "how you look"
      ],
      "salience_band": "medium",
      "presentation_priority": 18,
      "cluster_tags": [
        "3"
      ]
    },
    {
      "id": "ont_05c6804aec2c4e2c8de79c2f3895d8a6",
      "meaning_class": "source_supported",
      "locale": "en-US",
      "feature_predicate": {
        "type": "house_cusp",
        "house": 4
      },
      "normalized_proposition": "The fourth house is associated with the base a person operates from and returns to, rather than with what is done in view.",
      "source_fragment_ids": [
        "srcf_033a7aa60ee9a065cb8ec0c54b8c595d"
      ],
      "input_meaning_ids": [],
      "transformation_class": null,
      "tensions": [
        "The tension is that a base is judged only by whether it holds, which means it gets attention only when it does not."
      ],
      "counter_expressions": [
        "The counter-expression is that the base sets the ceiling on everything else."
      ],
      "prohibited_claims": [
        "your childhood",
        "your parents",
        "a family conflict"
      ],
      "salience_band": "medium",
      "presentation_priority": 19,
      "cluster_tags": [
        "3"
      ]
    },
    {
      "id": "ont_d6afbc4d1c02eb33a22c5ccfb51c4a83",
      "meaning_class": "source_supported",
      "locale": "en-US",
      "feature_predicate": {
        "type": "angle",
        "angle": "imum_coeli"
      },
      "normalized_proposition": "The imum coeli is associated with the private floor a person stands on, which is not shown and not explained.",
      "source_fragment_ids": [
        "srcf_ed575a239dabc83725cca4a19caf64e8"
      ],
      "input_meaning_ids": [],
      "transformation_class": null,
      "tensions": [
        "The tension is that an unexamined floor is still a floor."
      ],
      "counter_expressions": [
        "The counter-expression is that the footing is what makes exposure survivable."
      ],
      "prohibited_claims": [
        "your early home",
        "your parents",
        "a buried memory"
      ],
      "salience_band": "medium",
      "presentation_priority": 21,
      "cluster_tags": [
        "5"
      ]
    },
    {